Year,Month,Day,text,sentiment,text_word_count,text_imputed
2014,7,10, it means that you are now famous congrats,positive,8,False
2016,12,5,my phone passed away yesterday he jumped off the table  searching for a new phone,negative,15,False
2023,1,30,i have such fantastic friends including several ones met through here thanks for being in my life  you are such amazing people,positive,22,False
2021,1,15,tamlyn wishes she was as cool as my sock draw,positive,10,False
2010,11,12, so no rice or crusty bread with the chili  aawww,neutral,10,False
2018,8,7,  we are of like minds this evening  my dear,neutral,9,False
2017,7,18,come and save me from my packing please,neutral,8,False
2023,1,28,yes i love tea if that makes me typically english then so be it,positive,14,False
2019,6,25, a mouth for sure,positive,4,False
2020,9,15,dec0de i finally just have 1 hour of history at 300 pm but i went to my highschool at 800 am to make some homework with a friend,neutral,28,False
2022,7,25, pancakes with lemon and sugar thanks,positive,6,False
2015,9,1, si no bueno  i guess i just dont entertain him ,negative,10,False
2015,9,1,im so hunrgy right now and these heels kill me i can hardly walk in them,negative,16,False
2019,5,15,both electronic keys stopped working there is no keyhole cant get in my car so much for technology,negative,18,False
2019,4,18, yay three followers good to know more than one person in this big wide world likes fishies,positive,17,False
2019,11,10,my name is tony not hey   poor tony,negative,8,False
2016,12,12,goodmorning,positive,1,False
2018,3,15,took a shift tomorrow    i dont really feel like working right now,negative,12,False
2015,6,28, i love mine too  happy mothers day to your mom  john taylor   much love to you too ,positive,17,False
2015,12,18,saw a black snake in the garden  went back for a picture and it was gone,neutral,16,False
2015,11,10,httptwitpiccom4wukt  we bought ludi her own rug dogs are the best,positive,11,False
2015,9,28,no waterfront anymore   faccia luna and clarendon will have to do,negative,11,False
2023,2,15,loves her mum very much happy mothers day to all the wonderful mothers out there,positive,15,False
2017,8,22,slipped up and caught the flu  feeling like poop,negative,9,False
2020,3,15,i have an urge to play wow but i have to wait 2 weeks til im at my dads 547days til mcfly im so excited  l,positive,26,False
2023,3,10,ok  the passengers  no one is alive  theyre all dead  you just dont know it til the end  then you cry ,negative,21,False
2020,12,15,discovered  and  are sharing on g reader with me and didnt even know it sigh im such a g reader newb,neutral,21,False
2020,12,15,is chilled out tonite so cannot spew venom or write funny seems like these are the only 2 styles she has,neutral,21,False
2017,11,15, if u do please pray 4 me  lord knows i need it,neutral,12,False
2023,2,28,aaaaaw i want to live in the usa,neutral,8,False
2020,4,15,morning tweeple,positive,2,False
2021,4,5, hey i didnt get any ,neutral,5,False
2022,7,10, now you only have 2 hours to sleep   rest if you need it,positive,13,False
2020,4,2,  that makes my day so much better its been a rough one did i mention i love the new photo,neutral,20,False
2020,7,18,i dont want to sit at home on prom night someone hang out with me,negative,15,False
2015,7,12,is heading home from foot surgery and wishing she had a boyfriend to come over and cuddle with,positive,18,False
2021,10,8,concert tonight  chackin out and not coming tomorrow,neutral,8,False
2021,9,20, what happened i thought you were coming back today,neutral,9,False
2021,9,20, lol dammit  well then next time then,negative,7,False
2019,11,8, lol just dont ever forget me,positive,6,False
2019,10,8, still jealous,negative,2,False
2018,12,15,me at forever 21  ethan couldnt be there,negative,8,False
2016,6,15,now im sad but im not giving in firsti didnt do nothing    ,negative,12,False
2022,1,28,this week of mine was not easy  but finally its over ,negative,11,False
2022,1,8,   wow what a beautiful picture and by the wayi am straightjust wanted to let you know     bella,positive,17,False
2015,8,22,in arch drawing checking out mvccs cad degree looks good to me,positive,12,False
2019,4,18, there are people and then there are pencils some are sharp some are not and some can be sharpened  my pencil philosophy,neutral,22,False
2020,9,10,just about to go home im usually mr positive but this has been one of those daze well 15 mins until tomorrow,neutral,22,False
2017,11,5, but you always have lee lets go to paris,neutral,9,False
2021,7,20, you know you want to come keep me company whilst mums at her friends for the night  its such a nice evening,positive,22,False
2022,8,10,cooking with my dad  having lots of fun in the kitchen together,positive,12,False
2022,8,10,bouncing rush makes me feel nauseous,negative,6,False
2022,3,20,off to woolsery this morning to hopefully see north molton u16 clinch the north devon league title lovely day for it,positive,21,False
2019,5,5,playing singstar without my fave duetter,negative,6,False
2021,3,15,  youre missing out bb im such a cereal nut i think i like every kind available,positive,16,False
2021,8,2, thats just weird   oh and what was it you were drawing for me,negative,13,False
2021,6,10,just woke up o mums singing to her new gnr cd replacement i bought because im a good daughter,positive,19,False
2018,7,15,the birds are out oh man thats not cool  i didnt sleep yet for the night,negative,16,False
2019,11,2,250 miles down only 1750 to go thats ok u2 on the radio alwas helps,positive,15,False
2018,12,5,my street fighter iv skills are lacking cant beat seth on easy,negative,12,False
2023,1,15, fil 461 with cool people like me,positive,7,False
2023,1,18,good morning work and then its espns sunday night baseball hopefully it wont get rained out,positive,16,False
2016,11,28, i think its under a honeymoon by the good life  either that or its under a honey moon by joseph arthur,neutral,21,False
2021,10,2,my son got stung by a bug for the first time  his little finger is slightly swollen,negative,17,False
2022,11,28, it was hours ago i came in and its only now i realised when i went to buy something online,neutral,20,False
2022,7,5, oh just referring to our lil exchange on lj with regards to twitter archive postings,neutral,15,False
2016,9,28,bumping dj opus in the drunk in the car  lmao dont act like u dont know,negative,16,False
2021,9,15,why kiss the feet of the people who kick you when you can be anything that you want to  morning everyone hope you have the best day ever,positive,28,False
2022,2,28,heres a brief preview   omg james is creepy in that role im scared of him,negative,15,False
2023,1,16,im missing crab legs and attending my going away instead,negative,10,False
2018,11,7,hicks are mean,negative,3,False
2017,3,20,gettn ready to take a trip to jersey my dads not doing so good he needs a new heartwhoeva sees this please say a prayer for my dad,negative,28,False
2023,3,22,back soon need to run to the shops and cut the grass,neutral,12,False
2018,7,10,im up i have a plan to transform my bedroom today random,neutral,12,False
2021,11,30,home until tomorrow did my running and spinning now time for chiropractor laundry shopping and visiting family missing nathan,negative,19,False
2021,11,30, thats another sponsor,neutral,3,False
2023,1,22, and most of us are going to be stuck in an office some without windows,negative,15,False
2023,1,24, no its not sad should make you proud,negative,8,False
2023,1,27,   sorry well try to keep it down,negative,7,False
2023,3,3,is home alone doing hw,neutral,5,False
2015,10,18,according to  a quarter of families under six live in poverty,negative,11,False
2021,2,25,the plan to not spend money is not going well,negative,10,False
2022,5,30,uploading all my bamboozle pictures of facebook,neutral,7,False
2018,8,10, congratulations  you guys finish a month early than we do booo,positive,11,False
2019,3,25, actually i wish i was back in tahoe  i miss it there,negative,12,False
